{
  "contract_version": "1.0",
  "id_operacion": "123e4567-e89b-42d3-a456-426614174102",
  "tipo": "FOTO_ASOCIAR",
  "persona_uuid": "123e4567-e89b-42d3-a456-426614174200",
  "expected_persona_version": 2,
  "archivo": {
    "campo_multipart": "foto",
    "sha256": "aaaaaaaaaaaaaaaaaaaaaaaaaaaaaaaaaaaaaaaaaaaaaaaaaaaaaaaaaaaaaaaa",
    "mime_declarado": "image/jpeg",
    "bytes": 245000
  },
  "ocurrido_en": "2026-08-30 16:02:00",
  "usuario": { "id": "42", "nombre": "AUXILIAR TIC", "rol": "CARNETIZACION" }
}
